<dataset xmlns:xsi="http://www.w3.org/2001/XMLSchema-instance"
         xsi:noNamespaceSchemaLocation="../../../dataset.xsd">

	<!--other-->
	<customers id="@auto" version="@auto" name="@auto" tax_number="@auto" maturity_interval="@auto" mobile="@auto"
	           email="@auto" web="@auto" updated="@auto"/>

	<!--name-->
	<customers id="@auto" version="@auto" name="Name ZCa" tax_number="@auto" maturity_interval="@auto" mobile="@auto"
	           email="@auto" web="@auto" updated="@auto"/>
	<customers id="@auto" version="@auto" name="Name ABc" tax_number="@auto" maturity_interval="@auto" mobile="@auto"
	           email="@auto" web="@auto" updated="@auto"/>
	<customers id="@auto" version="@auto" name="Name ABa" tax_number="@auto" maturity_interval="@auto" mobile="@auto"
	           email="@auto" web="@auto" updated="@auto"/>
	<customers id="@auto" version="@auto" name="Name AAa" tax_number="@auto" maturity_interval="@auto" mobile="@auto"
	           email="@auto" web="@auto" updated="@auto"/>

	<!--taxNo-->
	<customers id="@auto" version="@auto" name="@auto" tax_number="TaxNo ZCa" maturity_interval="@auto" mobile="@auto"
	           email="@auto" web="@auto" updated="@auto"/>
	<customers id="@auto" version="@auto" name="@auto" tax_number="TaxNo ABc" maturity_interval="@auto" mobile="@auto"
	           email="@auto" web="@auto" updated="@auto"/>
	<customers id="@auto" version="@auto" name="@auto" tax_number="TaxNo ABa" maturity_interval="@auto" mobile="@auto"
	           email="@auto" web="@auto" updated="@auto"/>
	<customers id="@auto" version="@auto" name="@auto" tax_number="TaxNo AAa" maturity_interval="@auto" mobile="@auto"
	           email="@auto" web="@auto" updated="@auto"/>

	<!--mobile-->
	<customers id="@auto" version="@auto" name="@auto" tax_number="@auto" maturity_interval="@auto" mobile="Mobile 601"
	           email="@auto" web="@auto" updated="@auto"/>
	<customers id="@auto" version="@auto" name="@auto" tax_number="@auto" maturity_interval="@auto" mobile="Mobile 503"
	           email="@auto" web="@auto" updated="@auto"/>
	<customers id="@auto" version="@auto" name="@auto" tax_number="@auto" maturity_interval="@auto" mobile="Mobile 502"
	           email="@auto" web="@auto" updated="@auto"/>
	<customers id="@auto" version="@auto" name="@auto" tax_number="@auto" maturity_interval="@auto" mobile="Mobile 501"
	           email="@auto" web="@auto" updated="@auto"/>

	<!--email-->
	<customers id="@auto" version="@auto" name="@auto" tax_number="@auto" maturity_interval="@auto" mobile="@auto"
	           email="Email ZCa" web="@auto" updated="@auto"/>
	<customers id="@auto" version="@auto" name="@auto" tax_number="@auto" maturity_interval="@auto" mobile="@auto"
	           email="Email ABc" web="@auto" updated="@auto"/>
	<customers id="@auto" version="@auto" name="@auto" tax_number="@auto" maturity_interval="@auto" mobile="@auto"
	           email="Email ABa" web="@auto" updated="@auto"/>
	<customers id="@auto" version="@auto" name="@auto" tax_number="@auto" maturity_interval="@auto" mobile="@auto"
	           email="Email AAa" web="@auto" updated="@auto"/>

	<!--web-->
	<customers id="@auto" version="@auto" name="web name 1" tax_number="@auto" maturity_interval="@auto" mobile="@auto"
	           email="@auto" web="Web ZCa" updated="@auto"/>
	<customers id="@auto" version="@auto" name="web name 2" tax_number="@auto" maturity_interval="@auto" mobile="@auto"
	           email="@auto" web="Web ABc" updated="@auto"/>
	<customers id="@auto" version="@auto" name="web name 3" tax_number="@auto" maturity_interval="@auto" mobile="@auto"
	           email="@auto" web="Web ABa" updated="@auto"/>
	<customers id="@auto" version="@auto" name="web name 4" tax_number="@auto" maturity_interval="@auto" mobile="@auto"
	           email="@auto" web="Web AAa" updated="@auto"/>

	<!--other-->
	<customers id="@auto" version="@auto" name="@auto" tax_number="@auto" maturity_interval="@auto" mobile="@auto"
	           email="@auto" web="@auto" updated="@auto"/>

</dataset>
